,budget,company,country,director,genre,gross,name,rating,released,runtime,score,star,votes,writer,year,isprofit,profitability_ratio,profitability_ratio_bucket,adult,id,imdb_id,original_title,overview,popularity,tagline,title,genres_edited,spoken_languages_edited,production_countries_edited,keywords_edited,year_released,budget_norm,runtime_norm,score_norm,votes_norm,popularity_norm
256,40000000,Universal Pictures,USA,Other,Biography,20113965,Big Miracle,PG,3.02.2012 00:00,107,6.5,Drew Barrymore,16132,Jack Amiel,2012,0,-0.497150875,-50,FALSE,78698,tt1430615,Big Miracle,"Based on an inspiring true story, a small-town news reporter (Krasinski) and a Greenpeace volunteer (Barrymore) enlist the help of rival superpowers to save three majestic gray whales trapped under the ice of the Arctic Circle. ‘Big Miracle’ is adapted from the nonfiction book ‘Freeing the Whales: How the Media Created the World’s Greatest Non-Event’ by Tom Rose.",6.159379,A family of whales trapped beneath the ice. One unforgettable rescue.,Big Miracle,"Adventure, Drama, Romance",en,"GB, US","whale, alaska, aftercreditsstinger, duringcreditsstinger, greenpeace, animal protection",2012,0.14071111280116294,0.054540242817512415,0.08917648598685234,-0.8967250734935112,-1.048362866293693
257,2900000,Other,USA,Other,Horror,72140,No One Lives,R,10.05.2013 00:00,86,6.0,Luke Evans,14844,David Cohen,2012,0,-0.975124138,-100,FALSE,123109,tt1763264,No One Lives,A gang of ruthless highway killers kidnap a wealthy couple traveling cross country only to shockingly discover that things are not what they seem.,7.202832,No one runs. No one escapes.,No One Lives,"Horror, Thriller",en,US,"suicide, male nudity, female nudity, shotgun, restaurant, nudity, motel, highway, police, psychopath, murder, travel, gore, serial killer, gang, blood, slasher, torture, crash, extreme violence, violence, country, trailer, wrecking yard, kiddnapping, tracking device, person in car trunk",2013,-1.0279920901465078,-1.605766218766766,-0.5868776848053618,-0.9123732250637849,-0.7825959602934606
258,14000000,Paramount Pictures,USA,Other,Adventure,9402410,Fun Size,PG-13,26.10.2012 00:00,86,5.4,Victoria Justice,12027,Max Werner,2012,0,-0.328399286,-30,FALSE,82679,tt1663143,Fun Size,"Wren is invited to a Halloween party by her crush, Aaron Riley, but she is also forced by her mother to take her oddball little brother Albert with her when she goes out trick-or-treating on Halloween. When she goes to the party instead, she loses him and must find him before her mother finds out.",6.891823,Some people just can't handle Halloween.,Fun Size,Comedy,en,US,"halloween, friends, little brother, trick or treating, boyfriend girlfriend relationship",2012,-0.6783261722834582,-1.605766218766766,-1.3981426897560183,-0.9465974820307579,-0.8618097817767726
259,850000,Other,USA,Other,Comedy,1243961,"For a Good Time, Call...",R,2.11.2012 00:00,88,6.0,Ari Graynor,14242,Lauren Miller,2012,1,0.463483529,50,FALSE,84200,tt1996264,"For a Good Time, Call...","College ""frenemies"" Lauren and Katie move in together after losing a relationship and rent control, respectively. Sharing Katie's late grandmother's apartment in New York City, the girls bicker with each other until one fateful night, when Katie's noisy bedroom activities make Lauren barge in and discover a dirty little secret. This revelation brings them closer together, and Lauren (the brains) and Katie (the talent) concoct a wildly successful business venture. As profits swell, the girls reevaluate their hopes and dreams and realize that just because someone pees in your hair in college doesn't mean she won't be your best friend 10 years later.",10.378756,Lose your hang-ups. Find your calling.,"For a Good Time, Call...",Comedy,en,US,"crude humor, best friend, phone sex, innuendo, dirty joke",2012,-1.092570029932026,-1.4476417938539776,-0.5868776848053618,-0.9196870350368477,0.026310138181394136
260,40000000,Paramount Pictures,USA,Other,Comedy,37134215,The Guilt Trip,PG-13,19.12.2012 00:00,95,5.8,Barbra Streisand,32039,Dan Fogelman,2012,0,-0.071644625,-10,FALSE,82687,tt1694020,The Guilt Trip,An inventor and his mom hit the road together so he can sell his latest invention.,7.479014,Get ready for one mother of a road trip,The Guilt Trip,Comedy,en,US,"inventor, road trip, guilt, mother son relationship, woman director",2012,0.14071111280116294,-0.8942063066592181,-0.8572993531222477,-0.7034679717634299,-0.7122525565819792
261,11500000,Other,USA,Other,Action,5460,Universal Soldier: Day of Reckoning,R,25.10.2012 00:00,114,5.0,Jean-Claude Van Damme,17118,John Hyams,2012,0,-0.999525217,-100,FALSE,122857,tt1659343,Universal Soldier: Day of Reckoning,"In a world without government, the surviving Unisols maintain order and choose the strongest of their ranks to rule, testing them in life-or-death combat.",12.887287,Under their own command,Universal Soldier: Day of Reckoning,"Thriller, Action, Science Fiction, Horror, Mystery",en,US,"gore, extreme violence, extreme blood, slow motion action scene, ultra slow motion, gruesome, bloody spray ",2012,-0.7570797573877486,0.6079757300122719,-1.93898602638979,-0.8847459760957705,0.6652316061111139
262,40000000,DreamWorks,USA,Other,Comedy,18438149,A Thousand Words,PG-13,9.03.2012 00:00,91,5.9,Eddie Murphy,33384,Steve Koren,2012,0,-0.539046275,-50,FALSE,72358,tt0763831,A Thousand Words,"Jack McCall is a fast-talking literary agent, who can close any deal, any time, any way. He has set his sights on New Age guru Dr. Sinja (Cliff Curtis) for his own selfish purposes. But Dr. Sinja is on to him, and Jack’s life comes unglued after a magical Bodhi tree mysteriously appears in his backyard. With every word Jack speaks, a leaf falls from the tree and he realizes that when the last leaf falls, both he and the tree are toast. Words have never failed Jack McCall, but now he’s got to stop talking and conjure up some outrageous ways to communicate or he’s a goner.",5.446745,He only has 1000 words left to discover what matters the most.,A Thousand Words,"Drama, Comedy",en,US,"liar, literary agent",2012,0.14071111280116294,-1.210455156484795,-0.7220885189638041,-0.6871273165910555,-1.2298703546909375
263,26350000,Other,USA,Other,Comedy,20998,Lay the Favorite,R,22.06.2012 00:00,94,4.8,Rebecca Hall,9388,D.V. DeVincentis,2012,0,-0.999203112,-100,FALSE,84305,tt1132449,Lay the Favorite,A former stripper's talent with numbers lands her a job with a professional gambler who runs a sports book in Las Vegas.,5.153138,How far can a losing shot take you?,Lay the Favorite,"Drama, Comedy","en, es","GB, US","gambling, romance, money, las vegas, betting, prodigy",2012,-0.2892834618682631,-0.9732685191156123,-2.209407694706676,-0.9786591838894166,-1.3046518963320177
264,3000000,Other,USA,Other,Horror,2034,ATM,R,2.03.2012 00:00,90,4.7,Alice Eve,20140,Chris Sparling,2012,0,-0.999322,-100,FALSE,89691,tt1603257,ATM,"On a late night visit to an ATM, three co-workers end up in a desperate fight for their lives when they become trapped by an unknown man.",8.950643,No warning. No control. No escape.,ATM,"Horror, Thriller",en,"CA, US","atm, hooded figure, duringcreditsstinger",2012,-1.0248419467423362,-1.2895173689411892,-2.3446185288651185,-0.8480311359984357,-0.3374294585505239
265,20000000,Other,USA,Other,Drama,607327,Not Fade Away,R,19.07.2013 00:00,100,6.0,John Magaro,3860,David Chase,2012,0,-0.96963365,-100,FALSE,128270,tt1230215,Not Fade Away,"Set in suburban New Jersey in the 1960s, a group of friends form a rock band and try to make it big.",2.688548,there is no past no future either. just the Now--,Not Fade Away,Drama,en,US,"new jersey, rock band, country club, 1960s",2013,-0.48931756803316095,-0.498895244377247,-0.5868776848053618,-1.0458198841071755,-1.9323816156956244
266,23000000,Other,USA,Other,Drama,25568251,Her,R,10.01.2014 00:00,126,8.0,Joaquin Phoenix,404796,Spike Jonze,2013,1,0.111663087,10,FALSE,152601,tt1798709,Her,"In the not so distant future, Theodore, a lonely writer purchases a newly developed operating system designed to meet the user's every needs. To Theordore's surprise, a romantic relationship develops between him and his operating system. This unconventional love story blends science fiction and romance in a sweet tale that explores the nature of love and the ways that technology isolates and connects us all.",13.829515,A Spike Jonze Love Story,Her,"Romance, Science Fiction, Drama",en,"CN, US","artificial intelligence, computer, love, loneliness, transhumanism, heartbreak, near future, singularity, bittersweet",2014,-0.39481326590801236,1.5567222794890023,2.1173389983634947,3.8252261546966144,0.9052165602075487
267,37000000,New Line Cinema,USA,Other,Comedy,150394119,We're the Millers,R,7.08.2013 00:00,110,7.0,Jason Sudeikis,342500,Bob Fisher,2013,1,3.064705919,310,FALSE,138832,tt1723121,We're the Millers,A veteran pot dealer creates a fake family as part of his plan to move a huge shipment of weed into the U.S. from Mexico.,18.474368,#NAME?,We're the Millers,"Comedy, Crime",en,US,"mexico, police, gang, drug smuggling, drug, family",2013,0.046206810676014363,0.29172688018669507,0.7652306567790664,3.0683804635306404,2.08825806819679
268,40000000,Columbia Pictures,USA,Other,Crime,150117807,American Hustle,R,20.12.2013 00:00,138,7.3,Christian Bale,386428,Eric Warren Singer,2013,1,2.752945175,280,FALSE,168672,tt1800241,American Hustle,"A con man, Irving Rosenfeld, along with his seductive partner Sydney Prosser, is forced to work for a wild FBI agent, Richie DiMaso, who pushes them into a world of Jersey powerbrokers and mafia.",16.478036,Everyone Hustles To Survive,American Hustle,"Drama, Crime",en,US,"con artist, scam, mobster, fbi agent",2013,0.14071111280116294,2.505468828965733,1.1708631592543948,3.6020699062161885,1.5797934042500132
269,70000000,Other,USA,Other,Action,98925640,Olympus Has Fallen,R,22.03.2013 00:00,119,6.5,Gerard Butler,218879,Creighton Rothenberger,2013,1,0.413223429,40,FALSE,117263,tt2302755,Olympus Has Fallen,"When the White House (Secret Service Code: ""Olympus"") is captured by a terrorist mastermind and the President is kidnapped, disgraced former Presidential guard Mike Banning finds himself trapped within the building. As the national security team scrambles to respond, they are forced to rely on Banning's inside knowledge to help retake the White House, save the President and avert an even bigger disaster.",10.978188,When our flag falls our nation will rise.,Olympus Has Fallen,"Action, Thriller","en, ko",US,"white house, secret service, terrorist attack",2013,1.0857541340526489,1.003286792294243,0.08917648598685234,1.566485940806407,0.17898513935301516
270,12000000,Other,Other,Other,Comedy,15322921,About Time,R,8.11.2013 00:00,123,7.8,Domhnall Gleeson,228554,Richard Curtis,2013,1,0.276910083,30,FALSE,122906,tt2194499,About Time,"The night after another unsatisfactory New Year party, Tim's father tells his son that the men in his family have always had the ability to travel through time. Tim can't change history, but he can change what happens and has happened in his own life – so he decides to make his world a better place... by getting a girlfriend. Sadly, that turns out not to be as easy as he thinks.",11.213913,What if every moment in life came with a second chance?,About Time,"Comedy, Drama, Science Fiction",en,GB,"london england, father son relationship, time travel",2013,-0.7413290403668905,1.3195356421198197,1.8469173300466089,1.6840293153734864,0.23902416738485266
271,60000000,Warner Bros.,USA,Other,Action,46000903,Gangster Squad,R,11.01.2013 00:00,113,6.7,Sean Penn,184266,Will Beall,2013,0,-0.233318283,-20,FALSE,82682,tt1321870,Gangster Squad,"Los Angeles, 1949. Ruthless, Brooklyn-born mob king Mickey Cohen runs the show in this town, reaping the ill-gotten gains from the drugs, the guns, the prostitutes and — if he has his way — every wire bet placed west of Chicago. And he does it all with the protection of not only his own paid goons, but also the police and the politicians who are under his control. It’s enough to intimidate even the bravest, street-hardened cop… except, perhaps, for the small, secret crew of LAPD outsiders led by Sgt. John O’Mara and Jerry Wooters who come together to try to tear Cohen’s world apart.",8.581558,No Names. No Badges. No Mercy.,Gangster Squad,"Crime, Drama, Action, Thriller",en,US,"los angeles, gangster",2013,0.7707397936354868,0.5289135175558777,0.3595981543037382,1.1459661657273033,-0.43143520533652757
272,40000000,Other,USA,Other,Action,125095601,Lone Survivor,R,10.01.2014 00:00,121,7.5,Mark Wahlberg,224829,Peter Berg,2013,1,2.127390025,210,FALSE,193756,tt1091191,Lone Survivor,"Based on the failed June 28, 2005 mission ""Operation Red Wing."" Four members of SEAL Team 10, were tasked with the mission to capture or kill notorious Taliban leader, Ahmad Shah. Only one member of the team survived.",10.855502,Based on True Acts of Courage,Lone Survivor,"Action, Drama, Thriller, War",en,US,"war, survival, navy seal, military, dangerous mission",2014,0.14071111280116294,1.1614112172070314,1.4412848275712806,1.6387735975169107,0.14773708253632625
273,32000000,Columbia Pictures,USA,Other,Comedy,101470202,This Is the End,R,12.06.2013 00:00,107,6.6,James Franco,334845,Seth Rogen,2013,1,2.170943813,220,FALSE,109414,tt1245492,This Is the End,"While attending a party at James Franco's house, Seth Rogen, Jay Baruchel and many other celebrities are faced with the apocalypse.",11.414048,Nothing ruins a party like the end of the world.,This Is the End,"Action, Comedy",en,US,"rape, monster, panic, friendship, celebrity, satire, party, possession, dark comedy, end of the world, apocalypse, drug, demon, self-referential, actor",2013,-0.11130035953256662,0.054540242817512415,0.22438732014529467,2.9753784446871268,0.28999844196392466
274,28000000,Universal Pictures,USA,Other,Action,28795985,Kick-Ass 2,R,16.08.2013 00:00,103,6.6,Aaron Taylor-Johnson,219877,Jeff Wadlow,2013,1,0.028428036,0,FALSE,59859,tt1650554,Kick-Ass 2,"After Kick-Ass’ insane bravery inspires a new wave of self-made masked crusaders, he joins a patrol led by the Colonel Stars and Stripes. When these amateur superheroes are hunted down by Red Mist — reborn as The Mother Fucker — only the blade-wielding Hit-Girl can prevent their annihilation.",13.570264,You Can't Fight Your Destiny.,Kick-Ass 2,"Action, Adventure, Crime",en,"US, GB","crime fighter, secret identity, marvel comic, superhero, aftercreditsstinger, teen superheroes",2013,-0.2373060956994314,-0.2617086070080644,0.22438732014529467,1.5786108284361688,0.839185472896988
275,17000000,TriStar Pictures,USA,Other,Fantasy,54239856,Evil Dead,R,5.04.2013 00:00,91,6.5,Jane Levy,135944,Fede Alvarez,2013,1,2.190579765,220,FALSE,109428,tt1288558,Evil Dead,"Evil Dead, the fourth installment of the Evil Dead franchise, serving as both a reboot and as a loose continuation of the series, features Mia, a young woman struggling with sobriety, heads to a remote cabin with a group of friends where the discovery of a Book of the Dead unwittingly summon up dormant demons which possess the youngsters one by one.",12.01525,The most terrifying film you will ever experience.,Evil Dead,Horror,en,US,"remake, demon, necronomicon, duringcreditsstinger",2013,-0.5838218701583096,-1.210455156484795,0.08917648598685234,0.5588931997499982,0.4431242611634018
276,115000000,TriStar Pictures,USA,Other,Action,93050117,Elysium,R,9.08.2013 00:00,109,6.6,Matt Damon,366674,Neill Blomkamp,2013,0,-0.190868548,-20,FALSE,68724,tt1535108,Elysium,"In the year 2159, two classes of people exist: the very wealthy who live on a pristine man-made space station called Elysium, and the rest, who live on an overpopulated, ruined Earth. Secretary Rhodes (Jodie Foster), a hard line government ofﬁcial, will stop at nothing to enforce anti-immigration laws and preserve the luxurious lifestyle of the citizens of Elysium. That doesn’t stop the people of Earth from trying to get in, by any means they can. When unlucky Max (Matt Damon) is backed into a corner, he agrees to take on a daunting mission that, if successful, will not only save his life, but could bring equality to these polarized worlds.",15.232738,He can save us all.,Elysium,"Science Fiction, Action, Drama, Thriller",en,US,"dystopia, space station, class conflict",2013,2.5033186659298776,0.21266466773030082,0.22438732014529467,3.3620748859373157,1.2626166876098985
277,20000000,Universal Pictures,Other,Other,Action,26004851,The World's End,R,23.08.2013 00:00,109,7.0,Simon Pegg,207634,Simon Pegg,2013,1,0.30024255,30,FALSE,107985,tt1213663,The World's End,Five friends who reunite in an attempt to top their epic pub crawl from 20 years earlier unwittingly become humankind's only hope for survival.,9.830382,Good food. Fine ales. Total Annihilation.,The World's End,"Comedy, Action, Science Fiction",en,GB,"end of the world, apocalypse, trilogy, homage",2013,-0.48931756803316095,0.21266466773030082,0.7652306567790664,1.4298683442165556,-0.1133604184330114
278,60000000,Other,USA,Other,Action,31165421,The Mortal Instruments: City of Bones,PG-13,21.08.2013 00:00,130,5.9,Lily Collins,114481,Jessica Postigo,2013,0,-0.480576317,-50,FALSE,123553,tt1538403,The Mortal Instruments: City of Bones,"In New York City, Clary Fray, a seemingly ordinary teenager, learns that she is descended from a line of Shadowhunters — half-angel warriors who protect humanity from evil forces. After her mother disappears, Clary joins forces with a group of Shadowhunters and enters Downworld, an alternate realm filled with demons, vampires, and a host of other creatures. Clary and her companions must find and protect an ancient cup that holds the key to her mother's future.",14.336187,You have been chosen,The Mortal Instruments: City of Bones,"Action, Adventure, Drama, Mystery, Romance, Fantasy",en,US,"angel, vampire, werewolf, warlock, downworlder, shadowhunter, demon hunter, based on young adult novel",2013,0.7707397936354868,1.8729711293145792,-0.7220885189638041,0.29813522059410863,1.0342656403261068
279,28000000,Other,USA,Other,Drama,71349120,Safe Haven,PG-13,14.02.2013 00:00,115,6.7,Julianne Hough,87269,Dana Stevens,2013,1,1.548182857,150,FALSE,112949,tt1702439,Safe Haven,"A young woman with a mysterious past lands in Southport, North Carolina where her bond with a widower forces her to confront the dark secret that haunts her.",7.598422,You know it when you find it,Safe Haven,Romance,"en, pt",US,"based on novel, small town, widower, single father, abusive husband",2013,-0.2373060956994314,0.6870379424686661,0.3595981543037382,-0.03246842888592991,-0.6818394045649016
280,50000000,Summit Entertainment,USA,Other,Action,25132228,Escape Plan,R,18.10.2013 00:00,115,6.7,Sylvester Stallone,192466,Miles Chapman,2013,0,-0.49735544,-50,FALSE,107846,tt1211956,Escape Plan,"Ray Breslin is the world's foremost authority on structural security. After analyzing every high security prison and learning a vast array of survival skills so he can design escape-proof prisons, his skills are put to the test. He's framed and incarcerated in a master prison he designed himself. He needs to escape and find the person who put him behind bars.",14.191611,No one breaks out alone.,Escape Plan,"Action, Thriller","en, de, ar, ur",US,"prison, muslim, ship, mystery, science fiction, escape, crime, prison escape, cia agent",2013,0.4557254532183249,0.6870379424686661,0.3595981543037382,1.245589490941779,0.9974422125321479
281,110000000,Other,USA,Other,Action,61737191,Ender's Game,PG-13,1.11.2013 00:00,114,6.7,Harrison Ford,197592,Gavin Hood,2013,0,-0.438752809,-40,FALSE,80274,tt1731141,Ender's Game,"Based on the classic novel by Orson Scott Card, Ender's Game is the story of the Earth's most gifted children training to defend their homeplanet in the space wars of the future.",12.500305,This is not a game.,Ender's Game,"Science Fiction, Action, Adventure",en,US,"based on novel, intolerance, chosen one, child prodigy, futuristic, space, science fiction, alien invasion, military school, morality tale, based on young adult novel",2013,2.3458114957212968,0.6079757300122719,0.3595981543037382,1.3078662183868281,0.5666675032547496
282,22000000,Other,Other,Other,Crime,11326836,Out of the Furnace,R,6.12.2013 00:00,116,6.8,Christian Bale,90855,Brad Ingelsby,2013,0,-0.485143818,-50,FALSE,164457,tt1206543,Out of the Furnace,"Two brothers live in the economically-depressed Rust Belt, when a cruel twist of fate lands one in prison. His brother is then lured into one of the most violent crime rings in the Northeast.",6.760321,Sometimes your battles choose you.,Out of the Furnace,"Thriller, Drama, Crime",en,US,"prison, brother brother relationship, drug dealer, brother, revenge, drug use, car accident, justice, family, bare knuckle fighting, rust belt, neo-noir, manslaughter, social decay, ptsd",2013,-0.42631469994972854,0.7661001549250603,0.4948089884621806,0.011098552116400609,-0.8953032689514153
283,26000000,Paramount Pictures,USA,Other,Action,49875291,Pain & Gain,R,26.04.2013 00:00,129,6.5,Mark Wahlberg,172482,Christopher Markus,2013,1,0.918280423,90,FALSE,134374,tt1980209,Pain & Gain,"Daniel Lugo, manager of the Sun Gym in 1990s Miami, decides that there is only one way to achieve his version of the American dream: extortion. To achieve his goal, he recruits musclemen Paul and Adrian as accomplices. After several failed attempts, they abduct rich businessman Victor Kershaw and convince him to sign over all his assets to them. But when Kershaw makes it out alive, authorities are reluctant to believe his story.",9.218002,Their American dream is bigger than yours.,Pain & Gain,"Thriller, Crime, Action",en,US,"miami, scam, crime, weight lifting, weightlifting, duringcreditsstinger",2013,-0.30030896378286376,1.793908916858185,0.08917648598685234,1.0028001578825003,-0.2693332680931517
284,12000000,Fox Searchlight Pictures,Other,Other,Drama,1702277,Stoker,R,5.04.2013 00:00,99,6.8,Mia Wasikowska,90922,Wentworth Miller,2013,0,-0.858143583,-90,FALSE,86825,tt1682180,Stoker,"After India's father dies, her Uncle Charlie, who she never knew existed, comes to live with her and her unstable mother. She comes to suspect this mysterious, charming man has ulterior motives and becomes increasingly infatuated with him.",7.222816,Innocence Ends.,Stoker,"Drama, Horror, Thriller",en,US,mystery,2013,-0.7413290403668905,-0.5779574568336413,0.4948089884621806,0.011912547578518888,-0.777506046469351
285,135000000,Other,USA,Other,Animation,187168425,The Croods,PG,22.03.2013 00:00,98,7.2,Nicolas Cage,163313,Chris Sanders,2013,1,0.386432778,40,FALSE,49519,tt0481499,The Croods,"The Croods is a prehistoric comedy adventure that follows the world's first family as they embark on a journey of a lifetime when the cave that has always shielded them from danger is destroyed. Traveling across a spectacular landscape, the Croods discover an incredible new world filled with fantastic creatures -- and their outlook is changed forever.",14.757874,Meet the first modern family.,The Croods,"Adventure, Animation, Comedy, Family, Fantasy",en,US,"stone age, daughter, father, prehistoric, ancient world, father daughter relationship, family, cavemen, aftercreditsstinger, duringcreditsstinger",2013,3.133347346764202,-0.6570196692900355,1.0356523250959524,0.8914042714323139,1.1416690876213083
286,45000000,Other,USA,Other,Action,12050299,The Last Stand,R,18.01.2013 00:00,107,6.4,Arnold Schwarzenegger,120452,Andrew Knauer,2013,0,-0.732215578,-70,FALSE,76640,tt1549920,The Last Stand,"Ray Owens is sheriff of the quiet US border town of Sommerton Junction after leaving the LAPD following a bungled operation. Following his escape from the FBI, a notorious drug baron, his gang, and a hostage are heading toward Sommerton Junction where the police are preparing to make a last stand to intercept them before they cross the border. Owens is reluctant to become involved but ultimately joins in with the law enforcement efforts",10.691321,Not in his town. Not on his watch.,The Last Stand,"Action, Crime, Thriller",en,US,"sheriff, small town, hostage, prisoner, fbi, border, escape, car chase, convoy, machine gun, neo-western",2013,0.2982182830097439,0.054540242817512415,-0.046034348171590016,0.3706780102106495,0.10592027201009845
287,50000,Other,USA,Other,Mystery,68877,Coherence,NOT RATED,6.08.2014 00:00,89,7.2,Emily Baldoni,71677,James Ward Byrkit,2013,1,0.37754,40,FALSE,220289,tt2866360,Coherence,"On the night a comet is passing near Earth, eight friends at a dinner party experience a troubling chain of reality bending events. When the power goes out, they discover that the only house on the street left with power also holds many secrets.",6.851243,Nothing is random,Coherence,"Thriller, Science Fiction",en,US,"paranoia, comet, alter ego, power outage, candle, parallel world, alternate reality, dinner party, ketamine, quantum physics, broken cellphone, glowstick",2014,-1.117771177165399,-1.3685795813975834,1.0356523250959524,-0.22189853702545514,-0.8721454854888605
288,120000000,Twentieth Century Fox Film Corporation,USA,Other,Action,132556852,The Wolverine,PG-13,26.07.2013 00:00,126,6.7,Hugh Jackman,364907,Mark Bomback,2013,1,0.104640433,10,FALSE,76170,tt1430132,The Wolverine,"Wolverine faces his ultimate nemesis - and tests of his physical, emotional, and mortal limits - in a life-changing voyage to modern-day Japan.",3.918287,"When he's most vulnerable, he's most dangerous.",The Wolverine,"Action, Science Fiction, Adventure, Fantasy",en,"GB, US","japan, samurai, mutant, world war i, marvel comic, superhero, based on comic, superhuman, duringcreditsstinger",2013,2.660825836138459,1.5567222794890023,0.3595981543037382,3.3406072742721964,-1.6191677678099794
