,budget,company,country,director,genre,gross,name,rating,released,runtime,score,star,votes,writer,year,isprofit,profitability_ratio,profitability_ratio_bucket,adult,id,imdb_id,original_title,overview,popularity,tagline,title,genres_edited,spoken_languages_edited,production_countries_edited,keywords_edited,year_released,budget_norm,runtime_norm,score_norm,votes_norm,popularity_norm
388,65000000,Other,USA,Other,Action,19075290,"I, Frankenstein",PG-13,24.01.2014 00:00,92,5.1,Aaron Eckhart,70705,Stuart Beattie,2014,0,-0.706534,-70,FALSE,100241,tt1418377,"I, Frankenstein","200 years after his shocking creation, Dr. Frankenstein's creature, Adam, still walks the earth. But when he finds himself in the middle of a war over the fate of humanity, Adam discovers he holds the key that could destroy humankind.",9.415817,"In the battle between good and evil, an immortal holds the key","I, Frankenstein","Horror, Thriller",en,"US, AU","soul, queen, anti hero, fantasy, prince, supernatural, frankenstein, good vs evil, gargoyles, fighting, demon, dark, imax, 3d",2014,0.9282469638440678,-1.1313929440284007,-1.8037751922313476,-0.23370754581917108,-0.21894989623985686
389,20000000,Other,Other,Other,Biography,52076908,Selma,PG-13,9.01.2015 00:00,128,7.5,David Oyelowo,69760,Paul Webb,2014,1,1.6038454,160,FALSE,273895,tt1020072,Selma,"""Selma,"" as in Alabama, the place where segregation in the South was at its worst, leading to a march that ended in violence, forcing a famous statement by President Lyndon B. Johnson that ultimately led to the signing of the Civil Rights Act.",7.107071,One dream can change the world.,Selma,"History, Drama",en,"GB, US","alabama, martin luther king, president, black american, civil rights, protest march, woman director, selma",2015,-0.48931756803316095,1.7148467044017908,1.4412848275712806,-0.2451885265908393,-0.8069862343982723
390,19000000,Other,USA,Other,Biography,2436062,Pawn Sacrifice,PG-13,25.09.2015 00:00,115,7.0,Tobey Maguire,29268,Steven Knight,2014,0,-0.871786211,-90,FALSE,245698,tt1596345,Pawn Sacrifice,American chess champion Bobby Fischer prepares for a legendary match-up against Russian Boris Spassky.,7.399209,On the board he fought the Cold War. In his mind he fought his madness.,Pawn Sacrifice,"Thriller, Drama",en,US,"chess, cold war, russia, biography, victory",2015,-0.5208190020748772,0.6870379424686661,0.7652306567790664,-0.7371333661743217,-0.7325788462503674
391,10000000,Other,USA,Other,Biography,12547189,Love & Mercy,PG-13,19.06.2015 00:00,121,7.4,John Cusack,28639,Oren Moverman,2014,1,0.2547189,30,FALSE,271714,tt0903657,Love & Mercy,The life of reclusive and eccentric Beach Boys songwriter and musician Brian Wilson.,10.444048,"The Life, Love and Genius of Brian Wilson",Love & Mercy,Drama,en,US,"therapist, musician, nervous breakdown, songwriter, pop music, the beach boys, psychotherapist",2015,-0.8043319084503229,1.1614112172070314,1.3060739934128383,-0.744775204169432,0.042939974720814233
392,132000000,Other,USA,Other,Animation,83348920,Penguins of Madagascar,PG,26.11.2014 00:00,92,6.7,Tom McGrath,66287,Michael Colton,2014,0,-0.368568788,-40,FALSE,270946,tt1911658,Penguins of Madagascar,"Skipper, Kowalski, Rico and Private join forces with undercover organization The North Wind to stop the villainous Dr. Octavius Brine from destroying the world as we know it.",22.201607,The Movie Event That Will Blow Their Cover,Penguins of Madagascar,"Family, Animation, Adventure, Comedy",en,US,"penguin, madagascar, 3d",2014,3.0388430446390533,-1.1313929440284007,0.3595981543037382,-0.28738264957497034,3.0375837943707538
393,5000000,Other,USA,Other,Biography,2450846,Kill the Messenger,R,10.04.2015 00:00,112,7.0,Jeremy Renner,36607,Peter Landesman,2014,0,-0.5098308,-50,FALSE,245916,tt1216491,Kill the Messenger,A reporter becomes the target of a vicious smear campaign that drives him to the point of suicide after he exposes the CIA's role in arming Contra rebels in Nicaragua and importing cocaine into California. Based on the true story of journalist Gary Webb.,13.524048,Can you keep a national secret?,Kill the Messenger,"Thriller, Crime, Drama, Mystery",en,US,biography,2015,-0.9618390786589038,0.44985130509948346,0.7652306567790664,-0.6479704901073657,0.8274142830803823
394,25000000,Summit Entertainment,USA,Other,Drama,28831145,Draft Day,PG-13,11.04.2014 00:00,110,6.8,Kevin Costner,43430,Scott Rothman,2014,1,0.1532458,20,FALSE,200505,tt2223990,Draft Day,"At the NFL Draft, general manager Sonny Weaver has the opportunity to rebuild his team when he trades for the number one pick. He must decide what he's willing to sacrifice on a life-changing day for a few hundred young men with NFL dreams.",5.596449,The greatest victories don't always happen on the field.,Draft Day,Drama,en,US,"sport, duringcreditsstinger",2014,-0.33181039782458,0.29172688018669507,0.4948089884621806,-0.5650765940173208,-1.1917408281134503
395,16000000,Paramount Pictures,USA,Other,Comedy,461162,"Men, Women & Children",R,17.10.2014 00:00,119,6.7,Kaitlyn Dever,25383,Jason Reitman,2014,0,-0.971177375,-100,FALSE,243684,tt3179568,"Men, Women & Children","Follows the story of a group of high school teenagers and their parents as they attempt to navigate the many ways the internet has changed their relationships, their communication, their self-image, and their love lives.",6.785735,Discover how little you know about the people you know.,"Men, Women & Children","Drama, Comedy",en,US,"high school, teenager, overprotective parent, pressure, self image",2014,-0.6153233042000257,1.003286792294243,0.3595981543037382,-0.78433295379118,-0.8888303371096459
396,10000000,Other,USA,Other,Comedy,7574066,While We're Young,R,17.04.2015 00:00,97,6.3,Ben Stiller,35437,Noah Baumbach,2014,0,-0.2425934,-20,FALSE,252512,tt1791682,While We're Young,An uptight documentary filmmaker and his wife find their lives loosened up a bit after befriending a free-spirited younger couple.,9.42755,Life Never Gets Old.,While We're Young,"Comedy, Drama, Mystery",en,US,"father-in-law, marriage, documentary filmmaking, hipster, middle age, documentary filmmaker, generation-x, generation-z, psychedelic drug",2015,-0.8043319084503229,-0.7360818817464296,-0.18124518233003356,-0.6621850377294313,-0.21596150758401841
397,45000000,Other,USA,Other,Drama,14904384,Step Up All In,PG-13,8.08.2014 00:00,112,6.0,Ryan Guzman,27883,Duane Adler,2014,0,-0.668791467,-70,FALSE,243683,tt2626350,Step Up All In,"All-stars from the previous Step Up installments come together in glittering Las Vegas, battling for a victory that could define their dreams and their careers.",8.588926,Every Step Has Led To This,Step Up All In,"Romance, Drama, Music",en,US,"street artist, dance contest, woman director",2014,0.2982182830097439,0.44985130509948346,-0.5868776848053618,-0.7539599887867666,-0.42955857978328266
398,6000000,Other,USA,Other,Crime,3319109,Veronica Mars,PG-13,13.03.2014 00:00,107,6.8,Kristen Bell,44057,Rob Thomas,2014,0,-0.446815167,-40,FALSE,177494,tt2771372,Veronica Mars,"Years after walking away from her past as a teenage private eye, Veronica Mars gets pulled back to her hometown - just in time for her high school reunion - in order to help her old flame Logan Echolls, who's embroiled in a murder mystery.",7.510159,She thought she was out,Veronica Mars,"Comedy, Drama, Crime",en,US,"california, sequel, murder, based on tv series, private detective, high school reunion, duringcreditsstinger, crowdfunding",2014,-0.9303376446171877,0.054540242817512415,0.4948089884621806,-0.557459054394214,-0.7043199421878693
399,28000000,Walt Disney Pictures,USA,Other,Comedy,66954149,"Alexander and the Terrible, Horrible, No Good, Very Bad Day",PG,10.10.2014 00:00,81,6.2,Steve Carell,33226,Rob Lieber,2014,1,1.391219607,140,FALSE,218778,tt1698641,"Alexander and the Terrible, Horrible, No Good, Very Bad Day","Alexander's day begins with gum stuck in his hair, followed by more calamities. Though he finds little sympathy from his family and begins to wonder if bad things only happen to him, his mom, dad, brother, and sister all find themselves living through their own terrible, horrible, no good, very bad day.",7.861004,One day can change everything.,"Alexander and the Terrible, Horrible, No Good, Very Bad Day","Family, Comedy",en,US,"based on novel, job interview, bad luck, wish, one day, based on children's book, driver's test",2014,-0.2373060956994314,-2.001077281048737,-0.3164560164884759,-0.6890468879793344,-0.6149599133838392
400,15000000,Other,USA,Other,Action,24984868,The November Man,R,27.08.2014 00:00,108,6.3,Pierce Brosnan,54875,Michael Finch,2014,1,0.665657867,70,FALSE,254904,tt2402157,The November Man,An ex- CIA operative is brought back in on a very personal mission and finds himself pitted against his former pupil in a deadly game involving high level CIA officials and the Russian president-elect.,13.310556,A spy is never out of the game.,The November Man,"Crime, Action, Thriller",en,"GB, US","cia, retired, agent",2014,-0.6468247382417419,0.13360245527390663,-0.18124518233003356,-0.42602916022711645,0.7730379879374274
401,2000000,Other,USA,Other,Drama,43282,Lost River,R,10.04.2015 00:00,95,5.8,Christina Hendricks,13654,Ryan Gosling,2014,0,-0.978359,-100,FALSE,167810,tt2366608,Lost River,"A single mother is swept into a dark underworld, while her teenage son discovers a road that leads him to a secret underwater town.",6.640704,Dive deep into the underwater town,Lost River,"Fantasy, Thriller",en,US,"underworld, lost city",2015,-1.0563433807840525,-0.8942063066592181,-0.8572993531222477,-0.9268307564058857,-0.9257696531537031
402,103000000,Other,USA,Other,Animation,131538435,Rio 2,G,11.04.2014 00:00,101,6.3,Jesse Eisenberg,64550,Don Rhymer,2014,1,0.277072184,30,FALSE,172385,tt2357291,Rio 2,"It's a jungle out there for Blu, Jewel and their three kids after they're hurtled from Rio de Janeiro to the wilds of the Amazon. As Blu tries to fit in, he goes beak-to-beak with the vengeful Nigel, and meets the most fearsome adversary of all: his father-in-law.",8.18534,"He's villainous, she's venomous.",Rio 2,"Animation, Adventure, Comedy, Family","en, pt",US,"bird, sequel, jungle, audition, amazon rainforest, parrots",2014,2.1253014574292837,-0.41983303192085286,-0.18124518233003356,-0.30848578566003676,-0.5323517123201674
403,6000000,Other,USA,Other,Comedy,3588432,Wish I Was Here,R,25.07.2014 00:00,106,6.7,Zach Braff,32275,Adam J. Braff,2014,0,-0.401928,-40,FALSE,231576,tt2870708,Wish I Was Here,"Aidan Bloom, a struggling actor, father and husband, is 35 years old and still trying to find a purpose for his life. He and his wife are barely getting by financially and Aidan passes his time by fantasizing about being the great futuristic Space-Knight he'd always dreamed he'd be as a little kid. When his ailing father can no longer afford to pay for private school for his two kids and the only available public school is on its last legs, Aidan reluctantly agrees to attempt to home-school them. Through teaching them about life his way, Aidan gradually discovers some of the parts of himself he couldn't find.",6.149295,Life is an occasion. Rise to it.,Wish I Was Here,"Drama, Comedy",en,US,"jew, independent film, homeschooling, family, struggling actor",2014,-0.9303376446171877,-0.024521969638881796,0.3595981543037382,-0.7006007638670132,-1.0509312555552184
404,5000000,Other,USA,Other,Comedy,440338,Laggies,R,24.10.2014 00:00,99,6.4,Keira Knightley,34852,Andrea Seigel,2014,0,-0.9119324,-90,FALSE,244264,tt2034031,Laggies,"Overeducated and underemployed, 28 year old Megan is in the throes of a quarterlife crisis. Squarely into adulthood with no career prospects, no particular motivation to think about her future and no one to relate to, Megan is comfortable lagging a few steps behind - while her friends check off milestones and celebrate their new grown-up status. When her high-school sweetheart proposes, Megan panics and- given an unexpected opportunity to escape for a week - hides out in the home of her new friend, 16-year old Annika and Annika's world-weary single dad Craig.",12.938085,Acting your age is so overrated.,Laggies,"Comedy, Romance",en,US,"friendship, coming of age, mother daughter relationship, female protagonist, father daughter relationship, mumblecore, woman director, young women",2014,-0.9618390786589038,-0.5779574568336413,-0.046034348171590016,-0.669292311540464,0.6781698288111295
405,60000000,Other,USA,Other,Animation,50837305,The Boxtrolls,PG,26.09.2014 00:00,96,6.8,Ben Kingsley,46486,Irena Brignull,2014,0,-0.152711583,-20,FALSE,170687,tt0787474,The Boxtrolls,"An orphaned boy raised by underground creatures called Boxtrolls comes up from the sewers and out of his box to save his family and the town from the evil exterminator, Archibald Snatcher.",11.563909,When troubles strikes friends stack together,The Boxtrolls,"Animation, Comedy, Family, Fantasy",en,US,"based on novel, stop motion, father daughter relationship, unlikely friendship, duringcreditsstinger",2014,0.7707397936354868,-0.8151440942028239,0.4948089884621806,-0.5279486815959259,0.3281679563551826
406,7000000,Other,USA,Other,Drama,14618727,Beyond the Lights,PG-13,14.11.2014 00:00,116,6.9,Gugu Mbatha-Raw,12718,Gina Prince-Bythewood,2014,1,1.088389571,110,FALSE,241771,tt3125324,Beyond the Lights,"Noni Jean is a hot new rising star. But not all is what it seems, and the pressure causes Noni to nearly fall apart - until she meets Kaz Nicol, a promising young cop and aspiring politician who's been assigned to her detail. Can Kaz's love give Noni the courage to find her own voice and break free to become the artist she was meant to be?",6.293515,"Open your heart, find your voice.",Beyond the Lights,"Romance, Drama",en,US,"talent, success, musician, woman director",2014,-0.8988362105754715,0.7661001549250603,0.6300198226206241,-0.938202394503538,-1.0141985007657324
407,25000000,Walt Disney Pictures,USA,Other,Biography,36447959,Million Dollar Arm,PG,16.05.2014 00:00,124,7.0,Jon Hamm,38459,Tom McCarthy,2014,1,0.45791836,50,FALSE,198185,tt1647668,Million Dollar Arm,"In a last-ditch effort to save his career, sports agent JB Bernstein (Jon Hamm) dreams up a wild game plan to find Major League Baseball’s next great pitcher from a pool of cricket players in India. He soon discovers two young men who can throw a fastball but know nothing about the game of baseball. Or America. It’s an incredible and touching journey that will change them all — especially JB, who learns valuable lessons about teamwork, commitment and family.",9.453942,"Sometimes to win, sometimes you have to change the game",Million Dollar Arm,Drama,"hi, en",US,"baseball, sport, duringcreditsstinger",2014,-0.33181039782458,1.3985978545762139,0.7652306567790664,-0.6254701976320963,-0.2092394796793998
408,1000000,Other,USA,Other,Drama,9837,Camp X-Ray,R,17.10.2014 00:00,117,7.0,Kristen Stewart,33542,Peter Sattler,2014,0,-0.990163,-100,FALSE,244506,tt2994190,Camp X-Ray,"A young woman joins the military to be part of something bigger than herself and her small-town roots. Instead, she ends up as a new guard at Guantanamo Bay, where her mission is far from black and white. Surrounded by hostile jihadists and aggressive squadmates, she strikes up an unusual friendship with one of the detainees.",11.153327,Connection takes courage,Camp X-Ray,Drama,en,US,"guantanamo bay, female soldier, female protagonist, american abroad, military police, unlikely friendship, thick accent, detainee",2014,-1.0878448148257687,0.8451623673814546,0.7652306567790664,-0.6852077452027765,0.2235929464607384
409,8500000,Other,Other,Other,Action,1109199,The Rover,R,20.06.2014 00:00,103,6.4,Guy Pearce,36879,Joel Edgerton,2014,0,-0.869506,-90,FALSE,157845,tt2345737,The Rover,"A decade after the collapse of the western world, Australia has become a lawless wasteland. As desperate outsiders pillage the country's precious mineral resources, taciturn Eric travels from town to town searching for signs of life.",6.561373,Fear the man with nothing left to lose.,The Rover,"Crime, Drama","zh, en",AU,"brother brother relationship, small town, hostage, motel, dystopia, australia, rifle, money, car accident, theft, dog, car chase, desert, neo-western, midget",2014,-0.8515840595128972,-0.2617086070080644,-0.046034348171590016,-0.6446659115148856,-0.9459752152824282
410,5000000,Other,USA,Other,Comedy,10429707,Moms' Night Out,PG,9.05.2014 00:00,98,5.4,Sarah Drew,11445,Jon Erwin,2014,1,1.0859414,110,FALSE,252680,tt3014666,Moms' Night Out,"Yearning for an evening without their kids, some friends plan a night out. But to do this, their husbands need to watch the kids. What can go wrong?",6.127302,What could go wrong?,Moms' Night Out,Comedy,en,US,"parent child relationship, wife husband relationship, stress, children, mother daughter relationship, parenthood, parenting, duringcreditsstinger",2014,-0.9618390786589038,-0.6570196692900355,-1.3981426897560183,-0.9536683082837853,-1.056532860575917
411,12500000,Screen Gems,USA,Other,Comedy,48637684,About Last Night,R,14.02.2014 00:00,100,6.1,Kevin Hart,18519,Leslye Headland,2014,1,2.89101472,290,FALSE,222899,tt1826590,About Last Night,"A modern reimagining of the classic romantic comedy, this contemporary version closely follows new love for two couples as they journey from the bar to the bedroom and are eventually put to the test in the real world.",9.543004,It's about compromise. It's about love. It's about a good wingman.,About Last Night,"Comedy, Romance",en,US,duringcreditsstinger,2014,-0.7255783233460324,-0.498895244377247,-0.45166685064691947,-0.8677249665072974,-0.1865554371952699
412,15000000,Other,Other,Other,Drama,26496583,The Woman in Black 2: Angel of Death,PG-13,2.01.2015 00:00,98,4.9,Helen McCrory,22255,Jon Croker,2014,1,0.766438867,80,FALSE,288158,tt2339741,The Woman in Black 2: Angel of Death,"40 years after the first haunting at Eel Marsh House, a group of children evacuated from WWII London arrive, awakening the house's darkest inhabitant.",6.942139,She Never Left,The Woman in Black 2: Angel of Death,"Thriller, Horror, Drama",en,"GB, US, CA","based on novel, haunted house, supernatural, sequel, haunting, ghost",2015,-0.6468247382417419,-0.6570196692900355,-2.0741968605482324,-0.822335607604702,-0.8489943242120257
413,5000000,Other,USA,Other,Comedy,37440,Rudderless,R,21.02.2015 00:00,105,7.5,Billy Crudup,14913,Casey Twenter,2014,0,-0.992512,-100,FALSE,244403,tt1798243,Rudderless,"A grieving father in a downward spiral stumbles across a box of his recently deceased son's demo tapes and lyrics. Shocked by the discovery of this unknown talent, he forms a band in the hope of finding some catharsis.",10.964584,The way back begins with a single chord.,Rudderless,"Music, Drama, Comedy",en,US,"father son relationship, rock band, grieving father",2015,-0.9618390786589038,-0.103584182095276,1.4412848275712806,-0.9115349312296631,0.17552020802479346
414,50000000,Walt Disney Pictures,USA,Other,Adventure,51183113,Muppets Most Wanted,PG,21.03.2014 00:00,107,6.4,Ricky Gervais,26380,James Bobin,2014,1,0.02366226,0,FALSE,145220,tt2281587,Muppets Most Wanted,"While on a grand world tour, The Muppets find themselves wrapped into an European jewel-heist caper headed by a Kermit the Frog look-alike and his dastardly sidekick.",7.244956,Taking the world by farce,Muppets Most Wanted,"Comedy, Adventure, Crime, Family","de, en",US,"musical, the muppets",2014,0.4557254532183249,0.054540242817512415,-0.046034348171590016,-0.7722202153474199,-0.7718670006293895
415,13000000,Other,USA,Other,Adventure,38916903,Earth to Echo,PG,2.07.2014 00:00,91,5.8,Teo Halm,16757,Henry Gayden,2014,1,1.993607923,200,FALSE,238603,tt2183034,Earth to Echo,"After a construction project begins digging in their neighborhood, best friends Tuck, Munch and Alex inexplicably begin to receive strange, encoded messages on their cell phones. Convinced something bigger is going on, they go to their parents and the authorities. When everyone around them refuses to take the messages seriously, the three embark on a secret adventure to crack the code and follow it to its source. But taking matters into their own hands gets the trio in way over their heads when they discover a mysterious being from another world who desperately needs their help. The epic, suspenseful and exciting journey that follows will change all of their lives forever.",12.412221,No one will ever believe our story.,Earth to Echo,"Family, Adventure, Science Fiction",en,US,"alien, found footage",2014,-0.7098276063251743,-1.210455156484795,-0.8572993531222477,-0.8891318322424079,0.5442325568334689
416,15000000,Other,USA,Other,Drama,30127963,When the Game Stands Tall,PG,22.08.2014 00:00,115,6.7,Jim Caviezel,13653,Scott Marshall Smith,2014,1,1.008530867,100,FALSE,232679,tt2247476,When the Game Stands Tall,A young coach turns a losing high school football program around to go undefeated for 12 consecutive seasons.,6.617708,"Its Not How Hard You Fall, Its How You Get Back Up",When the Game Stands Tall,Drama,en,US,"american football, sport, high school sports",2014,-0.6468247382417419,0.6870379424686661,0.3595981543037382,-0.9268429055918874,-0.9316267217235201
417,5000000,Other,Other,Other,Comedy,72273,Better Living Through Chemistry,NOT RATED,14.03.2014 00:00,91,6.3,Sam Rockwell,12284,Geoff Moore,2014,0,-0.9855454,-100,FALSE,157099,tt1609479,Better Living Through Chemistry,"A straight-laced pharmacist's uneventful life spirals out of control when he starts an affair with a trophy wife customer who takes him on a joyride involving sex, drugs and possibly murder.",7.392294,Happiness has no formula.,Better Living Through Chemistry,"Drama, Comedy",en,"GB, US","pharmacist, dark comedy, trophy wife",2014,-0.9618390786589038,-1.210455156484795,-0.18124518233003356,-0.9434751412283042,-0.734340092952415
418,3000000,Other,USA,Other,Drama,585640,The Disappearance of Eleanor Rigby: Them,R,12.09.2014 00:00,123,6.3,James McAvoy,9569,Ned Benson,2014,0,-0.804786667,-80,FALSE,157829,tt3729920,The Disappearance of Eleanor Rigby: Them,A New York couple's relationship is tested after the loss of their child. This film is the wide-released combination of the original two :him and :her volumes that premiered at the Cannes Film Festival.,6.266831,Two films. One love.,The Disappearance of Eleanor Rigby: Them,Drama,en,US,"new york, couple, loss of a child",2014,-1.0248419467423362,1.3195356421198197,-0.18124518233003356,-0.9764601812230972,-1.0209949009099748
419,110000000,Other,USA,Other,Action,155190832,San Andreas,PG-13,29.05.2015 00:00,114,6.1,Dwayne Johnson,167250,Carlton Cuse,2015,1,0.410825745,40,FALSE,254128,tt2126355,San Andreas,"In the aftermath of a massive earthquake in California, a rescue-chopper pilot makes a dangerous journey across the state in order to rescue his estranged daughter.",20.547925,"A rescue pilot survived an earthquake, this is what happens next",San Andreas,"Action, Drama, Thriller",en,"CA, US, AU","california, earthquake, catastrophe, disaster film, 3d, san andreas, san andreas california, rescue operation",2015,2.3458114957212968,0.6079757300122719,-0.45166685064691947,0.9392356167212641,2.616391897228979
420,28000000,Other,USA,Other,Biography,70259870,The Big Short,R,23.12.2015 00:00,130,7.8,Christian Bale,260244,Charles Randolph,2015,1,1.509281071,150,FALSE,318846,tt1596363,The Big Short,The men who made millions from a global economic meltdown.,13.143061,This is a true story.,The Big Short,"Comedy, Drama",en,US,"bank, fraud, biography, wall street, finances, based on true story, animated sequence, breaking the fourth wall, loan, financial crisis, real estate, mortgage",2015,-0.2373060956994314,1.8729711293145792,1.8469173300466089,2.0690370197694303,0.7303771034313604
421,65000000,Twentieth Century Fox Film Corporation,USA,Other,Action,110825712,Spy,R,5.06.2015 00:00,119,7.0,Melissa McCarthy,193925,Paul Feig,2015,1,0.705010954,70,FALSE,238713,tt3079380,Spy,"A desk-bound CIA analyst volunteers to go undercover to infiltrate the world of a deadly arms dealer, and prevent diabolical global disaster.",13.257467,One of the guys. One of the Spies.,Spy,"Action, Comedy, Crime","de, en, fr, it",US,"spy, cia, undercover, arms dealer, disaster, female spy, aftercreditsstinger, duringcreditsstinger",2015,0.9282469638440678,1.003286792294243,0.7652306567790664,1.2633151533183546,0.7595162487957062
422,75000000,Warner Bros.,USA,Other,Action,45445109,The Man from U.N.C.L.E.,PG-13,14.08.2015 00:00,116,7.3,Henry Cavill,212440,Guy Ritchie,2015,0,-0.394065213,-40,FALSE,203801,tt1638355,The Man from U.N.C.L.E.,"At the height of the Cold War, a mysterious criminal organization plans to use nuclear weapons and technology to upset the fragile balance of power between the United States and Soviet Union. CIA agent Napoleon Solo and KGB agent Illya Kuryakin are forced to put aside their hostilities and work together to stop the evildoers in their tracks. The duo's only lead is the daughter of a missing German scientist, whom they must find soon to prevent a global catastrophe.",14.656875,Saving the world never goes out of style.,The Man from U.N.C.L.E.,"Comedy, Action, Adventure","it, en, ru, de",US,"spy, cold war, remake, based on tv series, buddy cop, russian spy, american spy",2015,1.2432613042612297,0.7661001549250603,1.1708631592543948,1.48825733214104,1.1159446977933836
